03 - New Single Family Residential,2021-MSS-RES-00867,,BNSFT - New Single Family Townhouse,TED,NEW TOWNHOUSE/UNIT 6/VB/R-3,HONE ARCHITECTS AND BUILDERS,,90748.45,,213631.73,1855-F S 3RD ST W,TED 3+,90748.45,122883.28000000001,TED 3+,New Construction,1,02 Data Dump,2022-02-01,February,02,2022,2022
03 - New Single Family Residential,2021-MSS-RES-00868,,BNSFT - New Single Family Townhouse,TED,NEW TOWNHOUSE/UNIT 5 VB/R-3,HONE ARCHITECTS AND BUILDERS,,90748.45,,213631.73,1855-E S 3RD ST W,TED 3+,90748.45,122883.28000000001,TED 3+,New Construction,1,02 Data Dump,2022-02-01,February,02,2022,2022
03 - New Single Family Residential,2021-MSS-RES-00869,,BNSFT - New Single Family Townhouse,TED,NEW TOWNHOUSE/UNIT 4/VB/R-3,HONE ARCHITECTS AND BUILDERS,,90748.45,,213631.73,1855-D S 3RD ST W,TED 3+,90748.45,122883.28000000001,TED 3+,New Construction,1,02 Data Dump,2022-02-01,February,02,2022,2022
03 - New Single Family Residential,2021-MSS-RES-00870,,BNSFT - New Single Family Townhouse,TED,NEW TOWNHOUSE/UNIT 3/VB/R-3,HONE ARCHITECTS AND BUILDERS,,90748.45,,213631.73,1855-C S 3RD ST W,TED 3+,90748.45,122883.28000000001,TED 3+,New Construction,1,02 Data Dump,2022-02-01,February,02,2022,2022
03 - New Single Family Residential,2021-MSS-RES-00871,,BNSFT - New Single Family Townhouse,TED,NEW TOWNHOUSE/UNIT 2/VB/R-3,HONE ARCHITECTS AND BUILDERS,,90748.45,,213631.73,1855-B S 3RD ST W,TED 3+,90748.45,122883.28000000001,TED 3+,New Construction,1,02 Data Dump,2022-02-01,February,02,2022,2022
03 - New Single Family Residential,2021-MSS-RES-00872,,BNSFT - New Single Family Townhouse,TED,NEW TOWNHOUSE/UNIT 1/VB/R-3,HONE ARCHITECTS AND BUILDERS,,90748.45,,213631.73,1855-A S 3RD ST W,TED 3+,90748.45,122883.28000000001,TED 3+,New Construction,1,02 Data Dump,2022-02-01,February,02,2022,2022
06 - New Miscellaneous,2021-MSS-RES-00875,,BNRDG - New Detached Garage/Carport,TED,NEW DETACHED GARGE/ UNIT 6/ VB/U,HONE ARCHITECTS AND BUILDERS,,6956.4,,17331.84,1855-F S 3RD ST W,TED 3+,6956.4,10375.44,"Misc. (Garage, Shed, etc.)",New Construction,0,02 Data Dump,2022-02-01,February,02,2022,2022
06 - New Miscellaneous,2021-MSS-RES-00876,,BNRDG - New Detached Garage/Carport,TED,NEW DETACHED GARGE/ UNIT 5/ VB/U,HONE ARCHITECTS AND BUILDERS,,6956.4,,17331.84,1855-E S 3RD ST W,TED 3+,6956.4,10375.44,"Misc. (Garage, Shed, etc.)",New Construction,0,02 Data Dump,2022-02-01,February,02,2022,2022
06 - New Miscellaneous,2021-MSS-RES-00878,,BNRDG - New Detached Garage/Carport,TED,NEW DETACHED GARGE/ UNIT 4/ VB/U,HONE ARCHITECTS AND BUILDERS,,6956.4,,17331.84,1855-D S 3RD ST W,TED 3+,6956.4,10375.44,"Misc. (Garage, Shed, etc.)",New Construction,0,02 Data Dump,2022-02-01,February,02,2022,2022
06 - New Miscellaneous,2021-MSS-RES-00879,,BNRDG - New Detached Garage/Carport,TED,NEW DETACHED GARGE/ UNIT 3/VB/U,HONE ARCHITECTS AND BUILDERS,,6956.4,,17331.84,1855-C S 3RD ST W,TED 3+,6956.4,10375.44,"Misc. (Garage, Shed, etc.)",New Construction,0,02 Data Dump,2022-02-01,February,02,2022,2022
06 - New Miscellaneous,2021-MSS-RES-00880,,BNRDG - New Detached Garage/Carport,TED,NEW DETACHED GARAGE/ UNIT 2/VB/U,HONE ARCHITECTS AND BUILDERS,,6956.4,,17331.84,1855-B S 3RD ST W,TED 3+,6956.4,10375.44,"Misc. (Garage, Shed, etc.)",New Construction,0,02 Data Dump,2022-02-01,February,02,2022,2022
06 - New Miscellaneous,2021-MSS-RES-00881,,BNRDG - New Detached Garage/Carport,TED,NEW DETACHED GARGE/ UNIT 1/VB/U,HONE ARCHITECTS AND BUILDERS,,6956.4,,17331.84,1855-A S 3RD ST W,TED 3+,6956.4,10375.44,"Misc. (Garage, Shed, etc.)",New Construction,0,02 Data Dump,2022-02-01,February,02,2022,2022
03 - New Single Family Residential,2021-MSS-RES-00908,,BNSFR - New Single Family Residence,,NSFR/ATT GARAGE/VB/R-3,3GEN BUILDERS LLC,,229684.55,,740219.71,4050 MORNHINWEG WAY,SFR-DET,229684.55,510535.16,Single Dwelling Detached,New Construction,1,02 Data Dump,2022-02-01,February,02,2022,2022
02 - Remodel Residential,2021-MSS-RES-00972,,BAARR -  Add/Alter/Remodel Residential,,DETACHED GARAGE - no water/heat/ VB/ U,MCMAHON CONSTRUCTION,,30877.55,,88250.03,5241 CANYON RIVER RD,,30877.55,57372.479999999996,Residential,Addition/Remodel,0,02 Data Dump,2022-02-01,February,02,2022,2022
03 - New Single Family Residential,2021-MSS-RES-01017,,BNSFR - New Single Family Residence,ADU,NSFR-ADU/ATT GARAGE/STORAGE/VB/R-3,AYERS CONSTRUCTION,325000.0,59815.95,,191775.85,713 LONGSTAFF ST,ADU,384815.95,-193040.1,ADU,New Construction,0,02 Data Dump,2022-02-01,February,02,2022,2022
03 - New Single Family Residential,2021-MSS-RES-01018,,BNSFR - New Single Family Residence,ADU,NSFR-ADU/ATT GARAGE/VB/R-3,TROY KINDRED WOODWORKS LLC,,38540.6,,129105.07,2860 LESTER ST,ADU,38540.6,90564.47,ADU,New Construction,0,02 Data Dump,2022-02-01,February,02,2022,2022
03 - New Single Family Residential,2021-MSS-RES-01044,,BNSFR - New Single Family Residence,,NSFR/ATT GARAGE/VB/R-3,LM COX INC,,147051.6,,348021.32,2771 PANIOLO PL,SFR-DET,147051.6,200969.72,Single Dwelling Detached,New Construction,1,02 Data Dump,2022-02-01,February,02,2022,2022
02 - Remodel Residential,2021-MSS-RES-01056,,BAARR -  Add/Alter/Remodel Residential,,SFR/REPLACE BACK STAIRS/VB/R-3,OWNER,2000.0,0.0,,,804 MONROE ST,,2000.0,,Residential,Addition/Remodel,0,02 Data Dump,2022-02-01,February,02,2022,2022
02 - Remodel Residential,2021-MSS-RES-01060,,BAARR -  Add/Alter/Remodel Residential,,SFR/Kitchen remodel with a small addition to the garage/VB/R-3/U,ROYAL POINT CONSTRUCTION,70000.0,0.0,,,3339 HOLLIS ST,,70000.0,,Residential,Addition/Remodel,0,02 Data Dump,2022-02-01,February,02,2022,2022
06 - New Miscellaneous,2021-MSS-RES-01070,,BNRDG - New Detached Garage/Carport,,NEW DET GARAGE/VB/U,OWNER,,7638.4,,26828.3,1055 DICKINSON ST,,7638.4,19189.9,"Misc. (Garage, Shed, etc.)",New Construction,0,02 Data Dump,2022-02-01,February,02,2022,2022
01 - Remodel Commercial,2022-MSS-COM-00014,BAARC -  Add/Alter/Remodel Commercial,,,FARM 406/ PHASE 1/Framed Openings in Two Load Bearing Walls/VB/A-2,JACKSON CONTRACTOR GROUP INC,2000.0,0.0,,,1851 STEPHENS AVE,,2000.0,,Commercial,Addition/Remodel,0,02 Data Dump,2022-02-01,February,02,2022,2022
01 - Remodel Commercial,2022-MSS-COM-00018,BAARC -  Add/Alter/Remodel Commercial,,,"UM BUS BARN/ **ELECTRICAL REVIEW ONLY**/BLDG PERMIT FOR REVIEW PURPOSES ONLY, NO FEE OR PROJECT COST ASSOCIATED WITH THIS PERMIT",VALLEY ELECTRICAL CONTRACTING INC,,,,,14 CAMPUS DR,,0.0,,Commercial,Addition/Remodel,0,02 Data Dump,2022-02-01,February,02,2022,2022
01 - Remodel Commercial,2022-MSS-COM-00049,BCRRS -  Reroof/Reside Commercial,,,521 HARTMAN UNITS 5-10 / Remove & Replace 30# Felt / replace with 30-Year Malarkey Shingle / Malarkey #1030 Synthetic underlayment / Malarkey Artic ice & Water Shield / INSTALL PER IRC AND LISTING / 9:12 / VB / R-3,RHINO ROOFING,42000.0,0.0,,,521 HARTMAN ST  CONDO MASTER,,42000.0,,Commercial,Addition/Remodel,0,02 Data Dump,2022-02-01,February,02,2022,2022
01 - Remodel Commercial,2022-MSS-COM-00052,BCRRS -  Reroof/Reside Commercial,BRRRS - Reroof or Reside Residential,,521 HARTMAN UNITS 1-4 / Remove & Replace 30# Felt / replace with 30-Year Malarkey Shingle / Malarkey #1030 Synthetic underlayment / Malarkey Artic ice & Water Shield / INSTALL PER IRC AND LISTING / 9:12 / VB / R-3,RHINO ROOFING,25000.0,0.0,,,521 HARTMAN ST  CONDO MASTER,,25000.0,,Commercial,Addition/Remodel,0,02 Data Dump,2022-02-01,February,02,2022,2022
02 - Remodel Residential,2022-MSS-RES-00010,,BRRRS - Reroof or Reside Residential,,SFR / 6-16:12 / 1 arch layer / 1-2 stories of residential re-roof / R & R / Install synthetic underlayment / Install 50 year shingle / Ice and water shield / CRV / INSTALL PER IBC AND LISTING / VB / R-3,JARED LANGLEY ENTERPRISES INC,25000.0,0.0,,,124 SOUTHRIDGE DR,,25000.0,,Residential,Addition/Remodel,0,02 Data Dump,2022-02-01,February,02,2022,2022
02 - Remodel Residential,2022-MSS-RES-00018,,BRRRS - Reroof or Reside Residential,,SFR / 4:12 / 1 3 TAB LAYER / 1 STORY RESIDENTIAL RE-ROOF / R&R / INSTALL SYNTHETIC UNDERLAYMENT / INSTALL 50 YR SHINGLE / ICE AND WATER SHIELD / CRV / INSTALL PER IRC AND LISTING / VB / R-3,JARED LANGLEY ENTERPRISES INC,13000.0,0.0,,,192 GRANDVIEW WAY,,13000.0,,Residential,Addition/Remodel,0,02 Data Dump,2022-02-01,February,02,2022,2022
02 - Remodel Residential,2022-MSS-RES-00032,,BAARR -  Add/Alter/Remodel Residential,,SFR/BASEMENT REMODEL/VB/R-3,GARDEN CITY CONSTRUCTION LLC,50000.0,0.0,,,915 POPLAR ST,,50000.0,,Residential,Addition/Remodel,0,02 Data Dump,2022-02-01,February,02,2022,2022
02 - Remodel Residential,2022-MSS-RES-00042,,BRRRS - Reroof or Reside Residential,,SFR / REMOVE SHIGNLES / INSTALL NEW DRIP EDGE ICE AND WATER ON EAVES / STARTER COURSE FELT / NEW SHINGLES / RIDGE VENT AND RIDGE CAP / 20 SQ / 4:12 / INSTALL PER IRC AND LISTING / VB / R-3,A & B ROOFING CO,11000.0,0.0,,,3333 ELDORA LN,,11000.0,,Residential,Addition/Remodel,0,02 Data Dump,2022-02-01,February,02,2022,2022
02 - Remodel Residential,2022-MSS-RES-00043,,BRRRS - Reroof or Reside Residential,,SFR / REMOVE SHIGNLES / INSTALL NEW DRIP EDGE ICE AND WATER ON EAVES /  STARTER COURSE FELT / NEW SHINGLES / RIDGE VENT AND RIDGE CAP / 37 SQUARE OC DURATION ESTATE GREY / 4:12 / INSTALL PER IRC AND LISTING / VB / R-3,A & B ROOFING CO,22875.0,0.0,,,5049 JAIDEN LN,,22875.0,,Residential,Addition/Remodel,0,02 Data Dump,2022-02-01,February,02,2022,2022
02 - Remodel Residential,2022-MSS-RES-00045,,BRRRS - Reroof or Reside Residential,,SFR / REMOVE SHIGNLES / INSTALL NEW DRIP EDGE ICE AND WATER ON EAVES / STARTER COURSE FELT / NEW SHINGLES / RIDGE VENT AND RIDGE CAP / OC DURATION / 3:12 PITCH  / QUARRY GRAY / INSTLL PER IRC AND LISTING / VB / R-3,A & B ROOFING CO,18975.0,0.0,,,824 PARKVIEW WAY,,18975.0,,Residential,Addition/Remodel,0,02 Data Dump,2022-02-01,February,02,2022,2022
02 - Remodel Residential,2022-MSS-RES-00053,,BRRRS - Reroof or Reside Residential,,SFR / Take of old shingles / put new 30 year malarkey / nex /  ice water / sythetic layment / INSTALL ICE AND WATER SHIELD / INSTALL PER IRC AND LISTING / 10:12 / VB / R-3,NEW HORIZONS ROOFING LLC,25000.0,0.0,,,409 E PINE ST,,25000.0,,Residential,Addition/Remodel,0,02 Data Dump,2022-02-01,February,02,2022,2022
02 - Remodel Residential,2022-MSS-RES-00059,,BRRRS - Reroof or Reside Residential,,"SFR/REROOF/complete roof removal and replacement with architectural shingles, ice and water shield underlayment and ridge vent on a single story 5/12 sloped roof pitch on a single-story gabled roof design with attached garage/5:12/VB/R-3",JIM GUERRERO ROOFING,11200.0,0.0,,,2617 SKY DR,,11200.0,,Residential,Addition/Remodel,0,02 Data Dump,2022-02-01,February,02,2022,2022
02 - Remodel Residential,2022-MSS-RES-00061,,BRRRS - Reroof or Reside Residential,,SFR / 9-22:12 / 1 CEDAR SHINGLE LAYER / 2 STORY RESIDENTIAL RE-ROOF / R&R / INSTALL SYNTHETIC UNDERLAYMENT / INSTALL 50 YEAR SHINGLE / INSTALL ICE & WATER SHIELD / CRV / INSTALL PER IRC AND LISTING / VB / R-3,JARED LANGLEY ENTERPRISES INC,40000.0,0.0,,,102 WHITAKER DR,,40000.0,,Residential,Addition/Remodel,0,02 Data Dump,2022-02-01,February,02,2022,2022
02 - Remodel Residential,2022-MSS-RES-00068,,BRRRS - Reroof or Reside Residential,,"GARAGE ONLY / Remove & Replace 30# Felt / replace with 30-Year OWENS CORNING Shingle /
Malarkey #1030 Synthetic underlayment / Malarkey Artic ice & Water Shield / INSTALL PER IRC AND LISTING / 7:12 / VB / R-3",RHINO ROOFING,2000.0,0.0,,,1313 S 04TH ST W,,2000.0,,Residential,Addition/Remodel,0,02 Data Dump,2022-02-01,February,02,2022,2022
02 - Remodel Residential,2022-MSS-RES-00070,,BRRRS - Reroof or Reside Residential,,SFR / Remove shingles / install new drip edge ice and water on eaves / starter course felt / new shingles / ridge vent and ridge cap / INSTALL PER IRC AND LISTING / :12 / VB / R-3,A & B ROOFING CO,14725.0,0.0,,,805 SIMONS DR,,14725.0,,Residential,Addition/Remodel,0,02 Data Dump,2022-02-01,February,02,2022,2022
02 - Remodel Residential,2022-MSS-RES-00071,,BRRRS - Reroof or Reside Residential,,SFR / Remove shingles / install new drip edge ice and water on eaves / starter course felt / new shingles / ridge vent and ridge cap / INSTALL PER IRC AND LISTING / 12:12 / VB / R-3,A & B ROOFING CO,3600.0,0.0,,,114 SOUTHRIDGE DR,,3600.0,,Residential,Addition/Remodel,0,02 Data Dump,2022-02-01,February,02,2022,2022
02 - Remodel Residential,2022-MSS-RES-00072,,BRRRS - Reroof or Reside Residential,,SFR / Remove & Replace 30# Felt / replace with 30-Year Malarkey Shingle / Malarkey #1030 Synthetic underlayment / Malarkey Artic ice & Water Shield / INSTALL PER IRC AND LISTING / 7:12 / VB / R-3,RHINO ROOFING,16500.0,0.0,,,4886 LOWER MILLER CREEK RD,,16500.0,,Residential,Addition/Remodel,0,02 Data Dump,2022-02-01,February,02,2022,2022
02 - Remodel Residential,2022-MSS-RES-00075,,BRRRS - Reroof or Reside Residential,,SFR / VB / R-3 / INSTALL PER IRC AND LISTING / Remove existing shingles / ice and water shield on eaves to code and in valleys / style D flashing / Malarkey 30lb synthetic underlayment / Malarkey shingles / new plumbing vent pipe boots /  continuous ridge vent / Pitch 6:12,DUNN WRIGHT ROOFING AND REMODEL LLC,15700.0,0.0,,,112 RIDGE DR,,15700.0,,Residential,Addition/Remodel,0,02 Data Dump,2022-02-01,February,02,2022,2022
02 - Remodel Residential,2022-MSS-RES-00087,,BRRRS - Reroof or Reside Residential,,SFR / Remove & Replace 30# Felt / replace with 30-Year Malarkey Shingle / Malarkey #1030 Synthetic underlayment / Malarkey Artic ice & Water Shield / INSTALL PER IRC AND LISTING / 4:12 / VB / R-3,RHINO ROOFING,13000.0,0.0,,,2401 SOUTH HILLS DR,,13000.0,,Residential,Addition/Remodel,0,02 Data Dump,2022-02-01,February,02,2022,2022
02 - Remodel Residential,2022-MSS-RES-00088,,BRRRS - Reroof or Reside Residential,,SFR / Remove old roofing materials / install new ice and water shield / flashing / drip edge / tar paper / ridge vent / architectural shingles / replace 1 section of damaged gutter / FELT UNDERLAYMENT / INSTALL PER IRC AND LISTING / 6:12 / VB / R-3,IVORY PEAKS LANDSCAPING AND EXCAVATION LLC,12000.0,0.0,,,2319 43RD ST,,12000.0,,Residential,Addition/Remodel,0,02 Data Dump,2022-02-01,February,02,2022,2022
02 - Remodel Residential,2022-MSS-RES-00092,,BRRRS - Reroof or Reside Residential,,SFR / Reshingle / Remove existing shingles / underlaent and edge metal / Install new drip edge / 2 rows of ice and water at eaves and 1 in valleys / the rest covered in synthetic underlayment / new starter  shingles @ 6 nails per / new ridge vent and ridge cap / INSTALL PER IRC AND LISTING / :12 / VB / R-3,R AND R ROOFING SPECIALTIES,10970.0,0.0,,,5210 LAREE CT,,10970.0,,Residential,Addition/Remodel,0,02 Data Dump,2022-02-01,February,02,2022,2022
02 - Remodel Residential,2022-MSS-RES-00093,,BRRRS - Reroof or Reside Residential,,"SFR / Remove & Replace 30# Felt / replace with 30-Year, Malarkey Shingle / Malarkey #1030 Synthetic underlayment / Malarkey Artic ice & Water Shield / INSTALL PER IRC AND LISTING / 3:12 / VB / R-3",RHINO ROOFING,12000.0,0.0,,,2502 SOUTH HILLS DR,,12000.0,,Residential,Addition/Remodel,0,02 Data Dump,2022-02-01,February,02,2022,2022
01 - Remodel Commercial,2020-MSS-COM-00076,BAARC -  Add/Alter/Remodel Commercial,,,"2018 CODES/ SOUTHGATE MALL/ 2016 Conditional Use Permit, Southgate Mall is developing a portion of their site that is located between the AMC Theater and the Southeast Anchor Building (previously the Sears Anchor).  This will include a New Mall Plaza and Building Enhancements to an existing South Mall Entrance/VB/MRev 01 - 09/02/2021: V5 REVIEW 8/16/21 REVISION TO PLAZA DESIGN",DICK ANDERSON CONSTRUCTION,250000.0,0.0,,,2901 BROOKS ST - SHELL,,250000.0,0.0,Commercial,Addition/Remodel,0,08 Data Dump,2021-08-01,August,08,2021,2022
01 - Remodel Commercial,2020-MSS-COM-00183,BAARC -  Add/Alter/Remodel Commercial,,,"APT BLDG/REMODEL TO ADD UNITS, 22 TOTAL/VB/R-2",RONALD BUILDERS LLC,500000.0,0.0,,,508 S 03RD ST W,MFR-APT,500000.0,0.0,Commercial,Addition/Remodel,0,08 Data Dump,2021-08-01,August,08,2021,2022
05 - New MultiFamily,2021-MSS-COM-00038,BNMRB - New Multifamily 5+ Units,,,NEW 48 UNIT APT BLDG/VB/R-2,B T W INC,,1815388.4,,4467551.2,2550 SOUTH AVE W,MFR-APT,1815388.4,2652162.8000000003,Multi-Dwelling Apartment,New Construction,48,08 Data Dump,2021-08-01,August,08,2021,2022
05 - New MultiFamily,2021-MSS-COM-00095,BNMRB - New Multifamily 5+ Units,,,MCNETT FLATS/ New Multi-Family Apartment Building/ 18 UNITS/ VB/ R2,TOLLEFSON CONSTRUCTION,,846891.06,,2084143.08,2760 GEORGE ELMER DR,MFR-APT,846891.06,1237252.02,Multi-Dwelling Apartment,New Construction,18,08 Data Dump,2021-08-01,August,08,2021,2022
05 - New MultiFamily,2021-MSS-COM-00106,BNMRB - New Multifamily 5+ Units,,,MCNETT FLATS BLDG 2/NEW 18 UNIT APT BLDG/ VB/ R2,TOLLEFSON CONSTRUCTION,,847165.98,,2084819.64,2770 GEORGE ELMER DR,MFR-APT,847165.98,1237653.66,Multi-Dwelling Apartment,New Construction,18,08 Data Dump,2021-08-01,August,08,2021,2022
01 - Remodel Commercial,2021-MSS-COM-00142,BAARC -  Add/Alter/Remodel Commercial,,,"SUITE 401/Tenant Improvement Project in Suite 401 on the 4th floor of the FIB Tower. Walls, floor coverings, ceilings, plumbing and lighting fixtures to be removed.  New Suite to be created on the West Side of the Floor Plate.  New interior walls, floor coverings, ceilings, Light fixtures and limited plumbing fixtures to be installed./IB/B",DICK ANDERSON CONSTRUCTION,998000.0,0.0,,,101 401 E FRONT ST,,998000.0,0.0,Commercial,Addition/Remodel,0,08 Data Dump,2021-08-01,August,08,2021,2022
08 - New Business,2021-MSS-COM-00188,BNCON -  New Other,,,MSO TERMINAL EXIT PLAZA/Install a prefabricated parking lot attendant booth and canopy for parking lot exit lanes./VB/B,KNIFE RIVER,,9954.0,28347.9,,5225 10 HWY W,BUS,9954.0,18393.9,Business,New Construction,0,08 Data Dump,2021-08-01,August,08,2021,2022
01 - Remodel Commercial,2021-MSS-COM-00194,BAARC -  Add/Alter/Remodel Commercial,,,"DEEP ROOTS/NEW TI/CHANGE OF USE/Interior Remodel Only, No new restrooms or structural.
Interior walls/doors, mechanical, plumbing and electrical scope including Change of Use letter/ VB/ B",TENANT,25000.0,0.0,,,801 RONAN ST  STE 5,,25000.0,0.0,Commercial,Addition/Remodel,0,08 Data Dump,2021-08-01,August,08,2021,2022
01 - Remodel Commercial,2021-MSS-COM-00209,BAARC -  Add/Alter/Remodel Commercial,,,SUITES 003 & 004/Interior remodel to tenant space/VB/B,MKC INC,107500.0,0.0,,,283 W FRONT ST  STE 103,,107500.0,0.0,Commercial,Addition/Remodel,0,08 Data Dump,2021-08-01,August,08,2021,2022
01 - Remodel Commercial,2021-MSS-COM-00214,BAARC -  Add/Alter/Remodel Commercial,,,DYE BIZ/Change of Use Permit/VB/F-1,APPLICANT,500.0,0.0,,,1850 IDAHO ST,,500.0,0.0,Commercial,Addition/Remodel,0,08 Data Dump,2021-08-01,August,08,2021,2022
01 - Remodel Commercial,2021-MSS-COM-00227,BAARC -  Add/Alter/Remodel Commercial,,,FIRST FLOOR TI/Tenant Improvement to the main floor/ VB/ B,EDGELL BUILDING AND DEVELOPMENT INC,100000.0,0.0,,,2829 GREAT NORTHERN LP  #100,,100000.0,0.0,Commercial,Addition/Remodel,0,08 Data Dump,2021-08-01,August,08,2021,2022
01 - Remodel Commercial,2021-MSS-COM-00229,BAARC -  Add/Alter/Remodel Commercial,,,"FRANKLIN SCHOOL ROOM S 140/142/Build and erect walls in rooms 140/142 (18'6 L x 9'6 H), 150/147 (25'6"" L x 9' H) and 232/233 (15' L x 8' H).  The walls will be built using 3 5/8"" 20ga steal studs and 5/8"" sheetrock. We insulated walls using bat insulation.  Sheeting is screwed off 12"" in the field and 8"" on the joints.  Walls are secured to floor, soffit and existing internal and external walls.  Currently, there are two classrooms that are divided by a wall that only spans half way across the room.  By design these walls were constructed to be finish when necessary.  We will be finishing the walls to make two separate classrooms due to COVID 19.  The walls will not have any plumbing or electrical installed.   There will be no electrical, mechanical or fire sprinkler impacts as again these were design to be finished when the time was needed./ VB/ E",OWNER,4000.0,0.0,,,1910 S 11TH ST W,,4000.0,0.0,Commercial,Addition/Remodel,0,08 Data Dump,2021-08-01,August,08,2021,2022
01 - Remodel Commercial,2021-MSS-COM-00230,BAARC -  Add/Alter/Remodel Commercial,,,"LOWELL SCHOOL ROOM 120/Build and erect walls in rooms 120 (31' L x  8' H), 215 (30' L x 8' 7"" H) and 321 (32' L x 8' H). The walls will be built using 3 5/8"" 20ga steal studs (16"" on center) and 5/8"" sheetrock. We insulated walls using bat insulation. Sheeting is screwed off 12"" in the field and 8"" on the joints. Walls are secured to floor, soffit and existing internal and external walls. Currently, there are two classrooms that are divided by a wall that only spans half way across the room. By design these walls were constructed to be finish when necessary. We will be finishing the walls to make two separate classrooms due to COVID 19. The walls will not have any plumbing or electrical installed. There will be no electrical, mechanical or fire sprinkler impacts as again these were design to be finished when the time was needed./ VB/ E",OWNER,4500.0,0.0,,,1200 SHERWOOD ST,,4500.0,0.0,Commercial,Addition/Remodel,0,08 Data Dump,2021-08-01,August,08,2021,2022
01 - Remodel Commercial,2021-MSS-COM-00230,BAARC -  Add/Alter/Remodel Commercial,,,"LOWELL SCHOOL ROOM 120/Build and erect walls in rooms 120 (31' L x  8' H), 215 (30' L x 8' 7"" H) and 321 (32' L x 8' H). The walls will be built using 3 5/8"" 20ga steal studs (16"" on center) and 5/8"" sheetrock. We insulated walls using bat insulation. Sheeting is screwed off 12"" in the field and 8"" on the joints. Walls are secured to floor, soffit and existing internal and external walls. Currently, there are two classrooms that are divided by a wall that only spans half way across the room. By design these walls were constructed to be finish when necessary. We will be finishing the walls to make two separate classrooms due to COVID 19. The walls will not have any plumbing or electrical installed. There will be no electrical, mechanical or fire sprinkler impacts as again these were design to be finished when the time was needed./ VB/ E",OWNER,4500.0,0.0,,,1215 PHILIPS ST,,4500.0,0.0,Commercial,Addition/Remodel,0,08 Data Dump,2021-08-01,August,08,2021,2022
01 - Remodel Commercial,2021-MSS-COM-00232,BAARC -  Add/Alter/Remodel Commercial,,,"LEWIS AND CLARK SCHOOL/Build and erect walls in room to create a new temporary classroom for COVID.  The walls will be built using 3 5/8"" 20ga structural steal studs and 5/8"" sheetrock.  Sheeting is screwed off 12"" in the field and 8"" on the joints. Walls are secured from floor to deck and existing internal walls.  The walls will not have any plumbing or electrical installed.  We will relocate 3 light fixtures and add one light fixture (Permit 2021-MSS-ELC-00623) There will be no mechanical or fire sprinkler impacts to this project/ VB/E",OWNER,4000.0,0.0,,,2901 PARK ST,,4000.0,0.0,Commercial,Addition/Remodel,0,08 Data Dump,2021-08-01,August,08,2021,2022
01 - Remodel Commercial,2021-MSS-COM-00233,BAARC -  Add/Alter/Remodel Commercial,,,GREAT HARVEST BREAD/Replace existing oven with two new ovens; replace existing exterior door with larger door; replace flooring in existing Bakery/ VB/ B,LENTZ CONSTRUCTION,40000.0,0.0,,,1407 S HIGGINS AVE,,40000.0,0.0,Commercial,Addition/Remodel,0,08 Data Dump,2021-08-01,August,08,2021,2022
01 - Remodel Commercial,2021-MSS-COM-00235,BCRRS -  Reroof/Reside Commercial,,,"QUALITY INN & SUITES/ Remove existing roofing, install d style drip edge, ice and water on eves and valleys, synthetic underlayment, 30 year GAF shingles, Remove debris/ INSTALL PER IBC AND LISTING/ 6:12/ VB/ R3",MILLER ROOFING INC,52800.0,0.0,,,4545 N RESERVE ST,,52800.0,0.0,Commercial,Addition/Remodel,0,08 Data Dump,2021-08-01,August,08,2021,2022
01 - Remodel Commercial,2021-MSS-COM-00237,BAARC -  Add/Alter/Remodel Commercial,,,SCHEELS/ Install shelving units for merchandise,CRITSER CONSTRUCTION INC,100000.0,0.0,,,2901 BROOKS ST - SCHEELS,,100000.0,0.0,Commercial,Addition/Remodel,0,08 Data Dump,2021-08-01,August,08,2021,2022
01 - Remodel Commercial,2021-MSS-COM-00241,BCRRS -  Reroof/Reside Commercial,,,FAMILY HOUSING/REROOF/TEAR OFF/SYNTHETIC UDL/ICE & WATER/ SHINGLES PER IRC AND LISTING /TWO STORY/5:12/VB/R-2,ACE ROOFING LLC,25000.0,0.0,,,1901 JARDINE CT,,25000.0,0.0,Commercial,Addition/Remodel,0,08 Data Dump,2021-08-01,August,08,2021,2022
01 - Remodel Commercial,2021-MSS-COM-00242,BCRRS -  Reroof/Reside Commercial,,,FAMILY HOUSING/REROOF/TEAR OFF/SYNTHETIC UDL/ICE & WATER/ SHINGLES PER IRC AND LISTING /TWO STORY/5:12/VB/R-2,ACE ROOFING LLC,25000.0,0.0,,,1909 JARDINE CT,,25000.0,0.0,Commercial,Addition/Remodel,0,08 Data Dump,2021-08-01,August,08,2021,2022
01 - Remodel Commercial,2021-MSS-COM-00243,BCRRS -  Reroof/Reside Commercial,,,FAMILY HOUSING/REROOF/TEAR OFF/SYNTHETIC UDL/ICE & WATER/ SHINGLES PER IRC AND LISTING /TWO STORY/5:12/VB/R-2,ACE ROOFING LLC,25000.0,0.0,,,1913 JARDINE CT,,25000.0,0.0,Commercial,Addition/Remodel,0,08 Data Dump,2021-08-01,August,08,2021,2022
01 - Remodel Commercial,2021-MSS-COM-00244,BCRRS -  Reroof/Reside Commercial,,,FAMILY HOUSING/REROOF/TEAR OFF/SYNTHETIC UDL/ICE & WATER/ SHINGLES PER IRC AND LISTING /TWO STORY/5:12/VB/R-2,ACE ROOFING LLC,25000.0,0.0,,,1801 EMIGRANT CT,,25000.0,0.0,Commercial,Addition/Remodel,0,08 Data Dump,2021-08-01,August,08,2021,2022
01 - Remodel Commercial,2021-MSS-COM-00245,BCRRS -  Reroof/Reside Commercial,,,FAMILY HOUSING/ REROOF/TEAR OFF/SYNTHETIC UDL/ICE & WATER/ SHINGLES PER IRC AND LISTING /TWO STORY/5:12/VB/R-2,ACE ROOFING LLC,25000.0,0.0,,,1809 EMIGRANT CT,,25000.0,0.0,Commercial,Addition/Remodel,0,08 Data Dump,2021-08-01,August,08,2021,2022
01 - Remodel Commercial,2021-MSS-COM-00246,BCRRS -  Reroof/Reside Commercial,,,FAMILY HOUSING/REROOF/TEAR OFF/SYNTHETIC UDL/ICE & WATER/ SHINGLES PER IRC AND LISTING /TWO STORY/5:12/VB/R-2,ACE ROOFING LLC,25000.0,0.0,,,1820 EMIGRANT CT,,25000.0,0.0,Commercial,Addition/Remodel,0,08 Data Dump,2021-08-01,August,08,2021,2022
