03 - New Single Family Residential,2021-MSS-RES-00665,,BNSFT - New Single Family Townhouse,,MILTON AND HOWELL/NEW TOWNHOME/VB/R-3,EBC DEVELOPMENT LLC,,28110.0,,66174.0,1065 MILTON ST,TED SF,28110.0,38064.0,TED Single Dwelling,New Construction,1,11 Data Dump,2021-11-01,November,11,2021,2022
03 - New Single Family Residential,2021-MSS-RES-00765,,BNSFR - New Single Family Residence,,NSFR/ ATT GARAGE/ BASEMENT/ COVERED AREA/ VB/ R3,ROCKY MOUNTAIN REMODELS,,176094.35,,603018.18,2209 FOX HOLLOW RD,SFR-DET,176094.35,426923.8300000001,Single Dwelling Detached,New Construction,1,11 Data Dump,2021-11-01,November,11,2021,2022
03 - New Single Family Residential,2021-MSS-RES-00821,,BNSFT - New Single Family Townhouse,,TOWNHOME/ BASEMENT/ PORCH/ VB/ R3,AMES AND ASSOCIATES CUSTOM BUILDERS,,107583.2,,270529.48,928-B TOOLE AVE,SFR-ATT,107583.2,162946.27999999997,Single Dwelling Attached,New Construction,1,11 Data Dump,2021-11-01,November,11,2021,2022
06 - New Miscellaneous,2021-MSS-RES-00824,,BNRDG - New Detached Garage/Carport,,Detached garage/ VB/ U,AMES AND ASSOCIATES CUSTOM BUILDERS,,11508.75,,32892.75,928-B TOOLE AVE,SFR-ATT,11508.75,21384.0,"Misc. (Garage, Shed, etc.)",New Construction,0,11 Data Dump,2021-11-01,November,11,2021,2022
03 - New Single Family Residential,2021-MSS-RES-00825,,BNSFT - New Single Family Townhouse,,NEW TOWNHOME/ BASEMENT./ PORCH/ VB/ R3/  Common wall separation.,AMES AND ASSOCIATES CUSTOM BUILDERS,,107583.2,,270529.48,928-A TOOLE AVE,SFR-ATT,107583.2,162946.27999999997,Single Dwelling Attached,New Construction,1,11 Data Dump,2021-11-01,November,11,2021,2022
06 - New Miscellaneous,2021-MSS-RES-00826,,BNRDG - New Detached Garage/Carport,,DETACHED GARAGE/ VB/ U,AMES AND ASSOCIATES CUSTOM BUILDERS,26000.0,11508.75,,32892.75,928-A TOOLE AVE,SFR-ATT,37508.75,-4616.0,"Misc. (Garage, Shed, etc.)",New Construction,0,11 Data Dump,2021-11-01,November,11,2021,2022
03 - New Single Family Residential,2021-MSS-RES-00844,,BNSFR - New Single Family Residence,TED,NSFR/ ATT GARAGE/ VB/ R3/,HONE ARCHITECTS AND BUILDERS,,137908.4,,325949.1,600 LINDEN ST,TED SF,137908.4,188040.69999999998,TED Single Dwelling,New Construction,1,11 Data Dump,2021-11-01,November,11,2021,2022
03 - New Single Family Residential,2021-MSS-RES-00846,,BNSFR - New Single Family Residence,,NSFR/ BASEMENT/ GARAGE/ VB/ R3,CORNERSTONE INC,,367939.3,,868483.5,2866 RUSTLER DR,SFR-DET,367939.3,500544.2,Single Dwelling Detached,New Construction,1,11 Data Dump,2021-11-01,November,11,2021,2022
03 - New Single Family Residential,2021-MSS-RES-00862,,BNSFR - New Single Family Residence,,NSFR/ VB/ R3,BOB MARTZ HOMES,,115485.25,,271864.85,5593 CATTLE DR,SFR-DET,115485.25,156379.59999999998,Single Dwelling Detached,New Construction,1,11 Data Dump,2021-11-01,November,11,2021,2022
06 - New Miscellaneous,2021-MSS-RES-00863,,BNRDG - New Detached Garage/Carport,,New Double Garage,BOB MARTZ HOMES,,13912.8,,34663.68,5593 CATTLE DR,SFR-DET,13912.8,20750.88,"Misc. (Garage, Shed, etc.)",New Construction,0,11 Data Dump,2021-11-01,November,11,2021,2022
02 - Remodel Residential,2021-MSS-RES-00873,,BAARR -  Add/Alter/Remodel Residential,,SFR/ Finish basement and man cave/ VB/ R3,OWNER,40000.0,0.0,,,1521 TAMARACK ST,,40000.0,0.0,Residential,Addition/Remodel,0,11 Data Dump,2021-11-01,November,11,2021,2022
02 - Remodel Residential,2021-MSS-RES-00907,,BAARR -  Add/Alter/Remodel Residential,,SFR/ Add 2nd story bedrooms and bath above existing garage.  Add garage bay.  New roof system over addition. Remodel existing 2nd story. Minimal work on existing 1st floor.,BROME DESIGN BUILD LLC,150000.0,0.0,,,3069 DUNCAN DR,,150000.0,0.0,Residential,Addition/Remodel,0,11 Data Dump,2021-11-01,November,11,2021,2022
03 - New Single Family Residential,2021-MSS-RES-00909,,BNSFR - New Single Family Residence,,NSFR/ ATT GARAGE/ VB/ R3,3GEN BUILDERS LLC,,168588.8,,398546.55,7054 MAX DR,SFR-DET,168588.8,229957.75,Single Dwelling Detached,New Construction,1,11 Data Dump,2021-11-01,November,11,2021,2022
03 - New Single Family Residential,2021-MSS-RES-00910,,BNSFR - New Single Family Residence,,NSFR/ ATT GARAGE/ VB/ R3,3GEN BUILDERS LLC,,90328.5,,213666.77,7050 MAX DR,SFR-DET,90328.5,123338.26999999999,Single Dwelling Detached,New Construction,1,11 Data Dump,2021-11-01,November,11,2021,2022
02 - Remodel Residential,2021-MSS-RES-00916,,BAARR -  Add/Alter/Remodel Residential,,DUPLEX/ remove and replace existing deck with same footprint/ VB/ R3,BUILT WELL CONSTRUCTION,12000.0,0.0,,,1630 DEFOE ST,,12000.0,0.0,Residential,Addition/Remodel,0,11 Data Dump,2021-11-01,November,11,2021,2022
02 - Remodel Residential,2021-MSS-RES-00920,,BAARR -  Add/Alter/Remodel Residential,,"SFR/Install 3 new 4 o x 4 o egress windows (2) on north side of house and (1) on the east side. wells are 56""x 36""x 60"" install new 3 o x 2 o window on the east side of house to replace existing window. 

Remove 74"" load bearing wall in basement east corner adj to stairs, replacing existing header (3,2 x 12's ) with (3) 11-7/8 x 1-3/4 LVL X 201-1/2 inch with 6 x 6 moisture resistant post's S,S,T ABA base's and C C Q column cap's, build new 2 x 6 x 36 wing wall east and west of new header and new 2 x 6 x 72"" wall north south to enclose storage room, Build new wall east and west 232-1/2"" to make second room in basement, build new 2 x 4 x 148-3/4"" wall north and south parallel to existing 2 x 6 wall to make hall way to bathroom and enclose storage area.   

Master bath replace vanity with double sink, remove bath tub and frame 68""x 58"" shower w/ center drain (homeowner will tile)/VB/R-3",INFINITY CONSTRUCTION AND REPAIR LLC,42298.07,0.0,,,3314 BANCROFT ST,,42298.07,0.0,Residential,Addition/Remodel,0,11 Data Dump,2021-11-01,November,11,2021,2022
02 - Remodel Residential,2021-MSS-RES-00927,,BAARR -  Add/Alter/Remodel Residential,,SFR/Remove existing wooden front deck and replace with new of the same size./VB/R-3,SHAMROCK CONSTRUCTION,7500.0,0.0,,,418 DALY AVE,,7500.0,0.0,Residential,Addition/Remodel,0,11 Data Dump,2021-11-01,November,11,2021,2022
02 - Remodel Residential,2021-MSS-RES-00939,,BAARR -  Add/Alter/Remodel Residential,,"SFR/ Renovation of existing bath/ laundry to include moving wall, relocating washer & dryer, relocating toilet and bathroom vanity.  A new framed wall will divide the bath/ laundry to create a mud rm. area.  We will install a beam where existing wall was located.  We are moving the entrance from the garage into home through mud room.  New flooring and light fixtures will be installed.
Renovation of M. Bath above is mostly cosmetic.  Room to stay same size.  Replacing vanity in same location.  Moving toilet and tiling a larger shower.  New tiled floor and light fixtures will be installed./ VB/ R3",OWNER,1500.0,0.0,,,104 KINNIKINNICK CT,,1500.0,0.0,Residential,Addition/Remodel,0,11 Data Dump,2021-11-01,November,11,2021,2022
02 - Remodel Residential,2021-MSS-RES-00943,,BAARR -  Add/Alter/Remodel Residential,,SFR/ Addition of 8x20 porch tied into existing roof and 8x20 deck.  remove existing concrete steps/ VB/ R3,OWNER,,1844.8,,2400.0,1010 PALMER ST,,1844.8,555.2,Residential,Addition/Remodel,0,11 Data Dump,2021-11-01,November,11,2021,2022
02 - Remodel Residential,2021-MSS-RES-00962,,BRRRS - Reroof or Reside Residential,,SFR / Tearing off and reroofing house with Arctic Seal ice and water / GAF TigerPAW synthetic underlayment / and GIF Timberline HDZ shingles / INSTALL PER IRC AND LISTING / 6:12 / VB / R-3,FISHER FAMILY CONSTRUCTION,18542.0,0.0,,,5615 KRISTIN LN,,18542.0,0.0,Residential,Addition/Remodel,0,11 Data Dump,2021-11-01,November,11,2021,2022
03 - New Single Family Residential,2021-MSS-RES-00963,,BNSFR - New Single Family Residence,,NSFR/ ATT GARAGE/ COVERED DECK/ VB/ R3,SUMMIT BUILDERS GROUP LLC,,101403.91,,252813.26,951 ANGLERS BEND WAY,SFR-DET,101403.91,151409.35,Single Dwelling Detached,New Construction,1,11 Data Dump,2021-11-01,November,11,2021,2022
02 - Remodel Residential,2021-MSS-RES-00971,,BAARR -  Add/Alter/Remodel Residential,,SFR/ Remove existing concrete patio and replace with new wooden/trex deck/ VB/ R3,SHAMROCK CONSTRUCTION,24000.0,0.0,,,2701 RUSTLER DR,,24000.0,0.0,Residential,Addition/Remodel,0,11 Data Dump,2021-11-01,November,11,2021,2022
02 - Remodel Residential,2021-MSS-RES-00974,,BRRRS - Reroof or Reside Residential,,"SFR / Install new Highlander shingles / Remove shingles / drip edge / pipe boots / underlayment and dispose / Install new underlayment and ice and water shield to
code / Repair minor water damage to decking free of charge (up
to 2 sheets) / If major water damage is found upon inspection after the
removal of the underlayment all repairs will be on a time and
material basis and charges will be added to final invoice / INSTALL PER IRC AND LISTING / 9:12 / VB / R-3",SCHROCK COMMERCIAL ROOFING INC,18762.0,0.0,,,6108 COBURG LN,,18762.0,0.0,Residential,Addition/Remodel,0,11 Data Dump,2021-11-01,November,11,2021,2022
02 - Remodel Residential,2021-MSS-RES-00976,,BRRRS - Reroof or Reside Residential,,SFR / Remove & Replace 30# Felt / replace with 30-Year / Malarkey Shingle / Malarkey #1030 Synthetic underlayment / Malarkey Artic ice & Water Shield / INSTALL PER IRC AND LISTING / :12 / VB / R-3,RHINO ROOFING,8600.0,0.0,,,1612 BEL-AIR PL,,8600.0,0.0,Residential,Addition/Remodel,0,11 Data Dump,2021-11-01,November,11,2021,2022
02 - Remodel Residential,2021-MSS-RES-00977,,BRRRS - Reroof or Reside Residential,,GARAGE / Remove & Replace 30# Felt / replace with 30-Year / Malarkey Shingle / Malarkey #1030 Synthetic underlayment / Malarkey Artic ice & Water Shield / INSTALL PER IRC AND LISTING / 5:12 / VB / U,RHINO ROOFING,2600.0,0.0,,,1612 BEL-AIR PL,,2600.0,0.0,Residential,Addition/Remodel,0,11 Data Dump,2021-11-01,November,11,2021,2022
02 - Remodel Residential,2021-MSS-RES-00978,,BAARR -  Add/Alter/Remodel Residential,,"SFR/ Kitchen remodel: move sink, move dishwasher, move fridge, move oven, move outlets, add new outlets, move water lines, move drain pipe, add new lights, remove non-structural wall/ VB/ R3",OWNER,2000.0,0.0,,,3652 KINGSBURY PL,,2000.0,0.0,Residential,Addition/Remodel,0,11 Data Dump,2021-11-01,November,11,2021,2022
02 - Remodel Residential,2021-MSS-RES-00980,,BRRRS - Reroof or Reside Residential,,SFR / Remove & Replace 30# Felt / replace with 30-Year / Malarkey Shingle / Malarkey #1030 Synthetic underlayment / Malarkey Artic ice & Water Shield / INSTALL PER IRC AND LISTING / 6:12 / VB / R-3,RHINO ROOFING,5000.0,0.0,,,2708 CARNOUSTIE WAY,,5000.0,0.0,Residential,Addition/Remodel,0,11 Data Dump,2021-11-01,November,11,2021,2022
02 - Remodel Residential,2021-MSS-RES-00985,,BRRRS - Reroof or Reside Residential,,SFR / Tear off existing TPO Membrane / inspect roof sheathing if any is found replace with new materials / installing Firestone 3” iso Rigid Insulation Board / Mechanically fastened Firestone 60 mill EPDM Roof System / Flash all penetrations / The existing roof structure has a roof pitch of 1:12 and will work effectively with the membrane / INSTALL PER IRC AND LISTING / 1:12 / VB / R-3,MAX TITE METAL SPECIALTIES INC,16400.0,0.0,,,621 FAIRVIEW AVE,,16400.0,0.0,Residential,Addition/Remodel,0,11 Data Dump,2021-11-01,November,11,2021,2022
02 - Remodel Residential,2021-MSS-RES-00986,,BAARR -  Add/Alter/Remodel Residential,,SFR/ Remodel Bathroom/ VB/ R3,WILD WOOD CONSTRUCTION,35617.0,0.0,,,600 E SUSSEX AVE,,35617.0,0.0,Residential,Addition/Remodel,0,11 Data Dump,2021-11-01,November,11,2021,2022
02 - Remodel Residential,2021-MSS-RES-00988,,BRRRS - Reroof or Reside Residential,,SFR / Remove and re-roof house and carport according to code and product manufacturer requirements. Install new roof boots and jacks / ICE AND WATER SHIELD / INSTALL PER IRC AND LISTING / 4:12 /VB / R-3,GRID LINES CONSTRUCTION,30250.0,0.0,,,2434 WYOMING ST,,30250.0,0.0,"Misc. (Garage, Shed, etc.)",New Construction,0,11 Data Dump,2021-11-01,November,11,2021,2022
02 - Remodel Residential,2021-MSS-RES-00994,,BRRRS - Reroof or Reside Residential,,"SFR / 8,9:12 / 1 arch layer / 1,2 story SF residential re-roof / R&R / install synthetic underlayment / install 50 year shingle / ice and water shield / CRV / INSTALL PER IRC AND LISTING / 8:12/ VB / R-3",JARED LANGLEY ENTERPRISES INC,20000.0,0.0,,,1201 LANDON'S WAY,,20000.0,0.0,Residential,Addition/Remodel,0,11 Data Dump,2021-11-01,November,11,2021,2022
02 - Remodel Residential,2021-MSS-RES-00995,,BRRRS - Reroof or Reside Residential,,SFR / 5:12 / 1 comp layer / 1-2 story sf residential re-roof / install synthetic underlayment / install 50 yr shingle / ice and water shield / CRV / INSTALL PER IRC AND LISTING / VB / R-3,JARED LANGLEY ENTERPRISES INC,19000.0,0.0,,,3880 FOX FARM RD,,19000.0,0.0,Residential,Addition/Remodel,0,11 Data Dump,2021-11-01,November,11,2021,2022
02 - Remodel Residential,2021-MSS-RES-00996,,BRRRS - Reroof or Reside Residential,,SFR / TEAR OFF EXISTING ROOF AND REPLANCE WITH SYNTHETIC UNDERLAYMENT/ RE-ROOF WITH SHINGLES / INSTALL WATER AND ICE SHIELD / INSTALL PER IRC AND LISTING / >4:12 / VB / R-3,OWNER,12000.0,0.0,,,510 W SPRUCE ST,,12000.0,0.0,Residential,Addition/Remodel,0,11 Data Dump,2021-11-01,November,11,2021,2022
02 - Remodel Residential,2021-MSS-RES-00999,,BRRRS - Reroof or Reside Residential,,SFR/ REMOVE OLD TPO/ INSTALL NEW 2.6 ISO BOARD/ 1/2 HD BOARD/ 60 MIL TPO AND 24 GAUGE CAPPING METAL/ INSTALL PER IBC AND LISTING/ OBSERVE LOW SLOPE REQUIREMENTS/ VB/ R3,INDEPENDENT ROOFING LLC,20000.0,0.0,,,201 E CENTRAL AVE,,20000.0,0.0,Residential,Addition/Remodel,0,11 Data Dump,2021-11-01,November,11,2021,2022
02 - Remodel Residential,2021-MSS-RES-01000,,BRRRS - Reroof or Reside Residential,,"CONDO / Remove existing roofing down to deck / replace with new 1/2"" insulation / 60 MIL TPO Membrane / INSTALL PER IBC AND LISTING / 0.25:12 / VB / R-2",SUMMIT ROOFING INC,16120.0,0.0,,,1364 DICKINSON ST,,16120.0,0.0,Residential,Addition/Remodel,0,11 Data Dump,2021-11-01,November,11,2021,2022
02 - Remodel Residential,2021-MSS-RES-01012,,BRRRS - Reroof or Reside Residential,,SFR / 6:12 / 1 arch layer / 2 story  sf residential re-roof / R&R / install synthetic underlayment / install 50 yr shingle / ice and water shield / CRV / INSTALL PER IRC AND LISTING / VB / R-3,JARED LANGLEY ENTERPRISES INC,11000.0,0.0,,,2840 SHEFFIELD DR,,11000.0,0.0,Residential,Addition/Remodel,0,11 Data Dump,2021-11-01,November,11,2021,2022
02 - Remodel Residential,2021-MSS-RES-01013,,BRRRS - Reroof or Reside Residential,,SFR / tear off and removal of old roofing materials / install synthetic underlayment / ice n water / architectural shingles / INSTALL PER IRC AND LISTING / 4:12 / VB / R-3,SIMPLY THE BEST ROOFING,5000.0,0.0,,,810 HART ST,,5000.0,0.0,Residential,Addition/Remodel,0,11 Data Dump,2021-11-01,November,11,2021,2022
02 - Remodel Residential,2021-MSS-RES-01014,,BRRRS - Reroof or Reside Residential,,SFR / REMOVE EXISTING ROOF / UNDERLAYMENT ICE AND WATER / SHINGLES / ICE AND WATER SHIELD / ISTALL PER IRC AND LISTING / 3:12 / VB / R-3,COMPTON ROOFING,9500.0,0.0,,,4308 21ST AVE,,9500.0,0.0,Residential,Addition/Remodel,0,11 Data Dump,2021-11-01,November,11,2021,2022
02 - Remodel Residential,2021-MSS-RES-01020,,BRRRS - Reroof or Reside Residential,,SFR / Remove & Replace 30# Felt / replace with 30-Year / Malarkey Shingle / Malarkey #1030 Synthetic underlayment / Malarkey Artic ice & Water Shield / INSTALL PER IRC AND LISTING / 6:12 / VB / R-3,RHINO ROOFING,14000.0,0.0,,,5611 GHARRETT AVE,,14000.0,0.0,Residential,Addition/Remodel,0,11 Data Dump,2021-11-01,November,11,2021,2022
02 - Remodel Residential,2021-MSS-RES-01021,,BRRRS - Reroof or Reside Residential,,SFR/ TEAR OFF/ REPLACE ICE AND WATER SHIELD/ SYNTHETIC UNDERLAYMENT/ SHINGLES PER IRC AND LISTING/ RIDGE CAP AND VENT./ INSTALL PER IRC AND LISTING./  5:12/ VB/ R3,INDEPENDENT ROOFING LLC,6100.0,0.0,,,1714 HOWELL ST,,6100.0,0.0,Residential,Addition/Remodel,0,11 Data Dump,2021-11-01,November,11,2021,2022
02 - Remodel Residential,2021-MSS-RES-01022,,BRRRS - Reroof or Reside Residential,,SFR/ TEAR OFF/ REPLACE ICE AND WATER SHEILD/ SYNTHETIC UNDERLAYMENT/ SHINGLES PER IRC AND LISTING/ RIDGE VENT AND CAP/ 5:12/ VB/ R3,INDEPENDENT ROOFING LLC,11800.0,0.0,,,4014 TIMBERLANE,,11800.0,0.0,Residential,Addition/Remodel,0,11 Data Dump,2021-11-01,November,11,2021,2022
02 - Remodel Residential,2021-MSS-RES-01024,,BRRRS - Reroof or Reside Residential,,SFR / Remove & Replace 30# Felt / replace with 30-Year / Malarkey Shingle / Malarkey #1030 Synthetic underlayment / Malarkey Artic ice & Water Shield / INSTALL PER IRC AND LISTING / 10:12 / VB / R-3,RHINO ROOFING,10000.0,0.0,,,107 S DAVIS ST,,10000.0,0.0,Residential,Addition/Remodel,0,11 Data Dump,2021-11-01,November,11,2021,2022
02 - Remodel Residential,2021-MSS-RES-01025,,BRRRS - Reroof or Reside Residential,,GARAGE / Remove & Replace 30# Felt / replace with 30-Year / Malarkey Shingle / Malarkey #1030 Synthetic underlayment / Malarkey Artic ice & Water Shield / INSTALL PER IRC AND LISTING / 10:12 / VB / U,RHINO ROOFING,3000.0,0.0,,,107 S DAVIS ST,,3000.0,0.0,Residential,Addition/Remodel,0,11 Data Dump,2021-11-01,November,11,2021,2022
02 - Remodel Residential,2021-MSS-RES-01034,,BRRRS - Reroof or Reside Residential,,"SFR/ Tear off existing roof down to the decking, then replace ice and water shield, shingles and underlayment./ INSTALL PER IRC AND LISTING/ OBSERVE LOW SLOP REQUIREMENTS. 4:12/ VB/ R3",CREATUM ROOFING AND REPAIR,7108.0,0.0,,,2971 SUNRISE PROMENADE,,7108.0,0.0,Residential,Addition/Remodel,0,11 Data Dump,2021-11-01,November,11,2021,2022
02 - Remodel Residential,2021-MSS-RES-01039,,BRRRS - Reroof or Reside Residential,,SFR / Remove & Replace 30# Felt / replace with 50-Year / Malarkey Shingle / Malarkey #1030 Synthetic underlayment / Malarkey Artic ice & Water Shield / INSTALL PER IRC AND LISTING / 5:12 / VB / R-3,RHINO ROOFING,13000.0,0.0,,,2801 RAYMOND AVE,,13000.0,0.0,Residential,Addition/Remodel,0,11 Data Dump,2021-11-01,November,11,2021,2022
,2021-MSS-RES-00286.01,,,,"10/8/21 REVISION TO ADD 2ND STORY TO PART OF HOUSE, CHANGE TO UNFINISHED BASEMENT",ROCKY MOUNTAIN REMODELS,,21808.1,,,435 E CENTRAL AVE,,21808.1,0.0,Modification to Work in Progress,Addition/Remodel,0,11 Data Dump,2021-11-01,November,11,2021,2022
02 - Remodel Residential,2020-MSS-RES-00537,,BAARR -  Add/Alter/Remodel Residential,,SFR/REMODEL/ADDITION/VB/R-3,OWNER,,37152.05,,87459.97,311 FAIRVIEW AVE,,37152.05,50307.92,Residential,Addition/Remodel,0,12 Data Dump,2021-12-01,December,12,2021,2022
01 - Remodel Commercial,2021-MSS-COM-00180,BAARC -  Add/Alter/Remodel Commercial,,,"TAP CLUB PH 1/REMODEL AND IMPROVEMENT OF (E) STRUCTURE AND PREVIOUS RESTAURANT (PERKINS) USE TO TAVERN & CASINO. / VB/ A-2

CONSTRUCTION COST TBD - CONTRACTOR ESTIMATE IN PROGRESS.",PEW CORPORATION,658467.0,0.0,,,2275 N RESERVE ST,,658467.0,0.0,Commercial,Addition/Remodel,0,12 Data Dump,2021-12-01,December,12,2021,2022
05 - New MultiFamily,2021-MSS-COM-00274,BNMRB - New Multifamily 5+ Units,,,BLDG D/NEW 6-PLEX/VB/R-2Rev 01 - 12/07/2021: 11/18/21 MECHANCIAL REVISION,EDGELL BUILDING AND DEVELOPMENT INC,,301862.16,,742862.88,3753 W BROADWAY   APTS A-F,MFR-APT,301862.16,441000.72000000003,Multi-Dwelling Apartment,New Construction,6,12 Data Dump,2021-12-01,December,12,2021,2022
05 - New MultiFamily,2021-MSS-COM-00276,BNMRB - New Multifamily 5+ Units,,,BLDG E/NEW 6-PLEX/VB/R-2Rev 01 - 12/07/2021: 11/18/21 MECHANCIAL REVISION,EDGELL BUILDING AND DEVELOPMENT INC,,301862.16,,742862.88,3759 W BROADWAY   ATPS A-F,MFR-APT,301862.16,441000.72000000003,Multi-Dwelling Apartment,New Construction,6,12 Data Dump,2021-12-01,December,12,2021,2022
08 - New Business,2021-MSS-COM-00308,BNCON -  New Other,,,UM HEAT POWER PLANT/New Combined Heat and Power plant adjacent to the existing heating plant on the University of Montana/ IIB/ F-1,MCKINSTRY ESSENTION LLC,,149708.16,603096.48,,840 CONNELL AVE,,149708.16,453388.31999999995,Business,New Construction,0,12 Data Dump,2021-12-01,December,12,2021,2022
01 - Remodel Commercial,2021-MSS-COM-00314,BAARC -  Add/Alter/Remodel Commercial,,,PINSPIRATION/ Tenant Improvement for Suites A & F/VB/A-3/B,SUMMIT CREEK INC,131000.0,0.0,,,3075-A N RESERVE ST,,131000.0,0.0,Commercial,Addition/Remodel,0,12 Data Dump,2021-12-01,December,12,2021,2022
01 - Remodel Commercial,2021-MSS-COM-00369,BAARC -  Add/Alter/Remodel Commercial,,,"HOMETREE/ Phase 2, a strictly mechanical submission that will be adding the mechanical systems for Flower Room 1, The Veg Rooms and The Cure Room./ VB./ B",OWNER,28000.0,0.0,,,1245 W BROADWAY,,28000.0,0.0,Commercial,Addition/Remodel,0,12 Data Dump,2021-12-01,December,12,2021,2022
01 - Remodel Commercial,2021-MSS-COM-00370,BAARC -  Add/Alter/Remodel Commercial,,,FELTON EYECARE/ CHANGE OF USE/ Interior TI - No Structural - MP Included/VB/B,KEATING BUILDERS INC,5000.0,0.0,,,2230 N RESERVE ST  STE 330,,5000.0,0.0,Commercial,Addition/Remodel,0,12 Data Dump,2021-12-01,December,12,2021,2022
01 - Remodel Commercial,2021-MSS-COM-00376,BAARC -  Add/Alter/Remodel Commercial,,,NUTRITION ON RESERVE/ Build a new non loading bearing wall for a storage room./VB/B,OWNER,50000.0,0.0,,,3055-A  N RESERVE ST,,50000.0,0.0,Commercial,Addition/Remodel,0,12 Data Dump,2021-12-01,December,12,2021,2022
01 - Remodel Commercial,2021-MSS-COM-00382,BAARC -  Add/Alter/Remodel Commercial,,,RMEF/ Interior only remodel of existing office space/VB/B,DICK ANDERSON CONSTRUCTION,50000.0,0.0,,,5705 GRANT CREEK RD,,50000.0,0.0,Commercial,Addition/Remodel,0,12 Data Dump,2021-12-01,December,12,2021,2022
01 - Remodel Commercial,2021-MSS-COM-00387,BAARC -  Add/Alter/Remodel Commercial,,,"COMMERCIAL/ Change of use from professional offices to mercantile (retail)
No alterations or additions./VB/M",APPLICANT,100.0,0.0,,,1120 W CENTRAL AVE,,100.0,0.0,Commercial,Addition/Remodel,0,12 Data Dump,2021-12-01,December,12,2021,2022
01 - Remodel Commercial,2021-MSS-COM-00401,BCRRS -  Reroof/Reside Commercial,,,HOTCHKISS HEATING & AIR / REROOFING THE BACK PART APPROX 1000 SQ FT / REMOVING METAL SHEETS / INSTALLING RECOVERY BOARD ADN TPO / INSTALL PER IBC AND LISTING / 0.5:12 / VB / R-2,DUNN WRIGHT ROOFING AND REMODEL LLC,8100.0,0.0,,,2221 S 03RD ST W,,8100.0,0.0,Commercial,Addition/Remodel,0,12 Data Dump,2021-12-01,December,12,2021,2022
01 - Remodel Commercial,2021-MSS-COM-00405,BAARC -  Add/Alter/Remodel Commercial,,,RETAIL/Change of Use from A to M (No construction required)/VB/M,OWNER,500.0,0.0,,,531 S HIGGINS AVE,,500.0,0.0,Commercial,Addition/Remodel,0,12 Data Dump,2021-12-01,December,12,2021,2022
01 - Remodel Commercial,2021-MSS-COM-00409,BCRRS -  Reroof/Reside Commercial,,,"COMM STORAGE BLDG/Remove and proper disposal of roofing material./Provide and Apply ice and water membrane per code./Provide and Apply, synthetic underlayment in succeeding courses./Provide and Apply Architectural Shingle System; High Wind Application:/Provide and Apply ridge vent and hip/ridge shingle./Provide and apply all related accessories require to complete roofing scope of work./VB/U",INDEPENDENT ROOFING LLC,17000.0,0.0,,,425 N 1ST ST W,,17000.0,0.0,Commercial,Addition/Remodel,0,12 Data Dump,2021-12-01,December,12,2021,2022
01 - Remodel Commercial,2021-MSS-COM-00411,BCRRS -  Reroof/Reside Commercial,,,"APT BLDG/REROOF PORCHES, MANSARD ROOF AND GABLE PORCHES/2:12 & 8:12/TWO STORY/VB/R-2

INSTALL PER  MANUFACTURERS LISTING AND IBC.",INDEPENDENT ROOFING LLC,65000.0,0.0,,,105 WASHINGTON ST,,65000.0,0.0,Commercial,Addition/Remodel,0,12 Data Dump,2021-12-01,December,12,2021,2022
03 - New Single Family Residential,2021-MSS-RES-00010,,BNSFT - New Single Family Townhouse,,"NEW TWO UNIT CONDO BLDG/ATT GARAGE/ VB/ R3
10/27/21 REVISION FOR RETAINING WALL IN PROCESS*",RATTLESNAKE CONSTRUCTION & INVESTMENTS LLC,,170746.4,,533876.88,1285-A BASECAMP DR,TED 2U,170746.4,363130.48,TED Two Unit,New Construction,1,12 Data Dump,2021-12-01,December,12,2021,2022
03 - New Single Family Residential,2021-MSS-RES-00010,,BNSFT - New Single Family Townhouse,,"NEW TWO UNIT CONDO BLDG/ATT GARAGE/ VB/ R3
10/27/21 REVISION FOR RETAINING WALL IN PROCESS*",RATTLESNAKE CONSTRUCTION & INVESTMENTS LLC,,,,,1285-B BASECAMP DR,TED 2U,0.0,0.0,TED Two Unit,New Construction,1,12 Data Dump,2021-12-01,December,12,2021,2022
03 - New Single Family Residential,2021-MSS-RES-00382,,BNSFR - New Single Family Residence,,NSFR/ATT GARAGE/ VB/ R3,FREEDOM BUILDERS INC,,162032.35,,383549.99,6916 SHAVER DR,SFR-DET,162032.35,221517.63999999998,Single Dwelling Detached,New Construction,1,12 Data Dump,2021-12-01,December,12,2021,2022
03 - New Single Family Residential,2021-MSS-RES-00497,,BNSFR - New Single Family Residence,ADU,NSFR-ADU/VB/R-3,OWNER,,37637.1,,89981.53,233 LIVINGSTON AVE,ADU,37637.1,52344.43,ADU,New Construction,0,12 Data Dump,2021-12-01,December,12,2021,2022
03 - New Single Family Residential,2021-MSS-RES-00784,,BNSFR - New Single Family Residence,,NSFR/ATT GARAGE/ PATIO/ BALCONY/ VB/ R3,HOYT HOMES INC,,213469.6,,506138.04,908 PARKVIEW WAY,SFR-DET,213469.6,292668.43999999994,Single Dwelling Detached,New Construction,1,12 Data Dump,2021-12-01,December,12,2021,2022
03 - New Single Family Residential,2021-MSS-RES-00903,,BNSFR - New Single Family Residence,,NSFR/ ATT GARAGE/ PARTIAL FINISH BASEMENT/ PORCH/ VB/ R3,AMES AND ASSOCIATES CUSTOM BUILDERS,,118074.66,,275091.46,3124 CUMMINS WAY,SFR-DET,118074.66,157016.80000000002,Single Dwelling Detached,New Construction,1,12 Data Dump,2021-12-01,December,12,2021,2022
03 - New Single Family Residential,2021-MSS-RES-00949,,BNSFT - New Single Family Townhouse,,NEW TOWNHOME/VB/R-3,CRICKET CONSTRUCTION LLC,,22949.2,,58780.8,2126 S 11TH ST W,TED SF,22949.2,35831.600000000006,TED Single Dwelling,New Construction,1,12 Data Dump,2021-12-01,December,12,2021,2022
03 - New Single Family Residential,2021-MSS-RES-00964,,BNSFR - New Single Family Residence,,NSFR/ATT GARAGE/VB/R-3,KINGS ELECTRIC AND CONTRACTING LLC,,136597.05,,322939.34,7027 MAX DR,SFR-DET,136597.05,186342.29000000004,Single Dwelling Detached,New Construction,1,12 Data Dump,2021-12-01,December,12,2021,2022
